<?xml version="1.0" encoding="UTF-8"?>
<banks xmlns:xsi="http://www.w3.org/2001/XMLSchema-instance"
       xmlns="http://www.example.org/banks"
       xsi:schemaLocation="http://www.example.org/banks schema.xsd">


    <private-bank id="ad01b1" profitability="10">
        <name>Belarusbank</name>
        <country>BELARUS</country>
        <type>CUMULATIVE</type>
        <depositor>Ivanov I.I.</depositor>
        <amount-on-deposit>10000</amount-on-deposit>
        <time-constraints>2021-09</time-constraints>
        <credit-rate>19</credit-rate>
        <mortgage-rate>25</mortgage-rate>
    </private-bank>

    <private-bank id="ad02b1" bank-type="SAVINGS">
        <name>Alfa-Bank</name>
        <country>RUSSIA</country>
        <type>SAVINGS</type>
        <depositor>Petrov P.P.</depositor>
        <amount-on-deposit>50000</amount-on-deposit>
        <time-constraints>2022-07</time-constraints>
        <credit-rate>15</credit-rate>
        <mortgage-rate>20</mortgage-rate>
    </private-bank>

    <national-bank id="nb01b1" profitability="3">
        <name>Belagroprombank</name>
        <country>BELARUS</country>
        <type>CUMULATIVE</type>
        <depositor>Sidorov S.V.</depositor>
        <amount-on-deposit>8000</amount-on-deposit>
        <time-constraints>2022-01</time-constraints>
        <refinancing-rate>9</refinancing-rate>
    </national-bank>

    <national-bank id="nb02b1" profitability="5" bank-type="EMISSIVE">
        <name>Ð¡entral bank</name>
        <country>RUSSIA</country>
        <type>METAL</type>
        <depositor>Petrov S.V.</depositor>
        <amount-on-deposit>8000000000</amount-on-deposit>
        <time-constraints>2026-01</time-constraints>
        <refinancing-rate>8</refinancing-rate>
    </national-bank>
</banks>